{"capabilities":[],"id":"sandbox.profile","mount_manifest":[{"kind":"tmpfs","read_only":false,"source":"u1-stage","target":"stage"},{"kind":"proc","read_only":true,"source":"proc","target":"proc"}],"namespace":{"mount":true,"network":true,"pid":true,"user":true},"quota_backend":{"enforced":true,"kind":"tmpfs-cgroup","version":1},"resource_limits":{"cpu_seconds":60,"memory_bytes":1048576,"pids":32,"tmpfs_bytes":8192,"tmpfs_inodes":32},"schema":"kilix.content.sandbox-profile/v1","seccomp":{"default_action":"kill","denied_syscalls":["mount","ptrace"],"profile_id":"sandbox-seccomp-v1"}}
